{
  "name": "research",
  "description": "Process any source into a structured, compounding knowledge base with refresh capability",
  "version": "0.5.2",
  "category": "research-knowledge",
  "tags": ["research", "knowledge-base", "web-scraping", "pdf", "github", "sources"],
  "skills": ["research", "refresh-research"],
  "requires": {
    "env": [
      {
        "name": "GH_TOKEN",
        "description": "GitHub personal access token — used by gh CLI for repository content fetching",
        "required": false,
        "sensitive": true,
        "when": "Processing GitHub repository URLs"
      }
    ]
  }
}
