{
  "name": "pr-sweep",
  "description": "Cross-repo PR sweep: triage all open PRs, run code reviews, merge what's ready, fix quick CI blockers, and report",
  "version": "0.2.2",
  "category": "devops",
  "tags": ["pull-request", "triage", "ci-cd", "code-review", "multi-repo"],
  "requires": {
    "env": [
      {
        "name": "GH_TOKEN",
        "description": "GitHub personal access token — used by gh CLI for PR discovery, CI checks, merging, and rebasing",
        "required": true,
        "sensitive": true,
        "when": "All pr-sweep operations require GitHub access"
      }
    ]
  }
}
