{
  "name": "harness-share",
  "description": "Compile, export, import, and sync harness configurations across Claude Code, Cursor, GitHub Copilot, Codex, OpenCode, Windsurf, Gemini CLI, and Junie",
  "version": "0.4.1",
  "category": "productivity",
  "tags": ["configuration", "export", "import", "yaml", "cross-platform"],
  "skills": ["harness-compile", "harness-export", "harness-import", "harness-sync", "harness-validate"]
}
