{
  "name": "membrain",
  "description": "Graph-based agent memory — search, trace, and manage what your agent knows",
  "version": "0.1.1",
  "category": "research-knowledge",
  "tags": ["memory", "knowledge-graph", "context", "governance", "mcp"],
  "skills": ["memory"],
  "mcp": {
    "server": {
      "command": "mem",
      "args": ["mcp"],
      "transport": "stdio"
    }
  }
}
